[
  {
    "source_id": "SRC-0001",
    "title": "In brief: How does the brain work?",
    "authors_or_owner": "InformedHealth.org / Institute for Quality and Efficiency in Health Care (IQWiG), hosted by NCBI Bookshelf",
    "source_type": "authoritative_government_resource",
    "topics": ["foundational neuroscience", "brain organization", "nervous system"],
    "publisher_or_journal": "NCBI Bookshelf, U.S. National Library of Medicine",
    "published_year": 2026,
    "source_last_updated": "2026-04-22",
    "doi": null,
    "url": "https://www.ncbi.nlm.nih.gov/books/NBK279302/",
    "population": "General public educational resource",
    "design_or_scope": "Authoritative educational overview of brain organization and function",
    "verification_state": "metadata_verified",
    "verified_on": "2026-09-15",
    "verified_by": "ChatGPT web verification; independent human reviewer pending",
    "provenance": "Official NCBI Bookshelf record fetched from current public web source.",
    "limitations": ["Educational overview, not a clinical guideline", "Not a primary research source"],
    "conflicts_or_funding_notes": null,
    "supersession_status": "current_checked",
    "superseded_by": null,
    "next_review_due": "2027-09-15",
    "notes": "Useful for ordinary human-system baseline and anatomy orientation, not for diagnostic inference."
  },
  {
    "source_id": "SRC-0002",
    "title": "Sleep Deprivation and Deficiency: What Makes You Sleep?",
    "authors_or_owner": "National Heart, Lung, and Blood Institute (NHLBI), NIH",
    "source_type": "authoritative_government_resource",
    "topics": ["sleep", "circadian rhythm", "sleep pressure", "body clock"],
    "publisher_or_journal": "NHLBI, National Institutes of Health",
    "published_year": 2022,
    "source_last_updated": "2022-03-24",
    "doi": null,
    "url": "https://www.nhlbi.nih.gov/health/sleep-deprivation/body-clock",
    "population": "General public educational resource",
    "design_or_scope": "Federal educational guidance on sleep pressure, circadian rhythm, light cues, and age-related timing changes",
    "verification_state": "metadata_verified",
    "verified_on": "2026-09-15",
    "verified_by": "ChatGPT web verification; independent human reviewer pending",
    "provenance": "Official NHLBI page; last-updated date visible on the page.",
    "limitations": ["Educational resource rather than systematic review", "Does not establish condition-specific treatment efficacy"],
    "conflicts_or_funding_notes": null,
    "supersession_status": "current_checked",
    "superseded_by": null,
    "next_review_due": "2027-03-24",
    "notes": "Appropriate for baseline circadian and sleep-process education."
  },
  {
    "source_id": "SRC-0003",
    "title": "VA/DoD Clinical Practice Guideline for the Management of Major Depressive Disorder",
    "authors_or_owner": "U.S. Department of Veterans Affairs / Department of Defense",
    "source_type": "clinical_guideline",
    "topics": ["CBT", "cognitive behavioral therapy", "major depressive disorder", "psychotherapy", "shared decision-making"],
    "publisher_or_journal": "VA/DoD Clinical Practice Guidelines",
    "published_year": 2022,
    "source_last_updated": null,
    "doi": null,
    "url": "https://www.healthquality.va.gov/guidelines/MH/mdd/",
    "population": "Adults with major depressive disorder in VA/DoD-relevant care settings",
    "design_or_scope": "Evidence-based clinical practice guideline covering assessment and treatment, including CBT",
    "verification_state": "metadata_verified",
    "verified_on": "2026-09-15",
    "verified_by": "ChatGPT web verification; independent human reviewer pending",
    "provenance": "Official VA/DoD guideline landing page and provider materials.",
    "limitations": ["Condition-specific to MDD; does not establish CBT efficacy for every diagnosis", "Clinical guideline is not a substitute for individualized care"],
    "conflicts_or_funding_notes": null,
    "supersession_status": "current_checked",
    "superseded_by": null,
    "next_review_due": "2027-09-15",
    "notes": "Provides a current authoritative CBT source family while preserving condition-specific applicability."
  },
  {
    "source_id": "SRC-0004",
    "title": "Effectiveness of interpersonal social rhythm therapy applied to individuals with bipolar disorder: A systematic review",
    "authors_or_owner": "Yeliz Aktas; Seyda Dulgerler",
    "source_type": "systematic_review",
    "topics": ["IPSRT", "interpersonal and social rhythm therapy", "bipolar disorder", "social rhythm"],
    "publisher_or_journal": "Journal of Psychiatric Nursing",
    "published_year": 2024,
    "source_last_updated": null,
    "doi": "10.14744/phd.2024.26428",
    "url": "https://phdergi.org/jvi.aspx?look4=&pdir=phd&plng=eng&un=PHD-26428",
    "population": "People with bipolar disorder represented in included randomized studies",
    "design_or_scope": "Systematic review of randomized controlled studies of IPSRT for bipolar disorder",
    "verification_state": "metadata_verified",
    "verified_on": "2026-09-15",
    "verified_by": "ChatGPT web verification; independent human full-text reviewer pending",
    "provenance": "Journal landing page with DOI and systematic-review description.",
    "limitations": ["Included literature was searched through the review period and may not include later trials", "Effectiveness may vary by phase, comparator, treatment combination, and population"],
    "conflicts_or_funding_notes": null,
    "supersession_status": "current_checked",
    "superseded_by": null,
    "next_review_due": "2027-09-15",
    "notes": "Use for IPSRT evidence discovery; claim-level effect statements require full-text extraction."
  },
  {
    "source_id": "SRC-0005",
    "title": "Bipolar disorder: assessment and management (CG185)",
    "authors_or_owner": "National Institute for Health and Care Excellence (NICE)",
    "source_type": "clinical_guideline",
    "topics": ["bipolar I", "bipolar II", "bipolar disorder", "psychological interventions", "pharmacology", "shared decision-making"],
    "publisher_or_journal": "NICE",
    "published_year": 2014,
    "source_last_updated": "2025-09-02",
    "doi": null,
    "url": "https://www.nice.org.uk/guidance/cg185",
    "population": "Children, young people, and adults with suspected or diagnosed bipolar disorder",
    "design_or_scope": "Clinical guideline covering recognition, assessment, crisis care, psychological and pharmacological management, monitoring, and recovery",
    "verification_state": "metadata_verified",
    "verified_on": "2026-09-15",
    "verified_by": "ChatGPT web verification; independent human reviewer pending",
    "provenance": "Official NICE guidance page; current page reports update on 2025-09-02.",
    "limitations": ["Recommendations reflect NICE/UK healthcare context", "Individual recommendations have different evidence dates and strengths"],
    "conflicts_or_funding_notes": null,
    "supersession_status": "current_checked",
    "superseded_by": null,
    "next_review_due": "2027-09-02",
    "notes": "Current guideline status does not imply every recommendation was newly reviewed in 2025."
  },
  {
    "source_id": "SRC-0006",
    "title": "Attention deficit hyperactivity disorder: diagnosis and management (NG87)",
    "authors_or_owner": "National Institute for Health and Care Excellence (NICE)",
    "source_type": "clinical_guideline",
    "topics": ["ADHD", "attention", "executive function", "diagnosis", "management", "CBT"],
    "publisher_or_journal": "NICE",
    "published_year": 2018,
    "source_last_updated": "2019-09-13",
    "doi": null,
    "url": "https://www.nice.org.uk/guidance/ng87/",
    "population": "Children, young people, and adults with ADHD or suspected ADHD",
    "design_or_scope": "Clinical guideline for recognition, diagnosis, support, non-pharmacological treatment, medication, monitoring, and review",
    "verification_state": "metadata_verified",
    "verified_on": "2026-09-15",
    "verified_by": "ChatGPT web verification; independent human reviewer pending",
    "provenance": "Official NICE guideline page; NICE reports review on 2025-05-07 and minor diagnostic-link update.",
    "limitations": ["Core recommendations include evidence from earlier review cycles", "UK service structure may differ from other jurisdictions"],
    "conflicts_or_funding_notes": null,
    "supersession_status": "current_but_older",
    "superseded_by": null,
    "next_review_due": "2027-05-07",
    "notes": "NICE states the guideline will be reviewed if new evidence is likely to change recommendations."
  },
  {
    "source_id": "SRC-0007",
    "title": "Obsessive-compulsive disorder and body dysmorphic disorder: treatment (CG31)",
    "authors_or_owner": "National Institute for Health and Care Excellence (NICE)",
    "source_type": "clinical_guideline",
    "topics": ["OCD", "ERP", "exposure and response prevention", "CBT", "family accommodation", "SSRI"],
    "publisher_or_journal": "NICE",
    "published_year": 2005,
    "source_last_updated": null,
    "doi": null,
    "url": "https://www.nice.org.uk/guidance/cg31",
    "population": "Children, young people, and adults with OCD or body dysmorphic disorder",
    "design_or_scope": "Clinical guideline including CBT/ERP and pharmacological treatment recommendations",
    "verification_state": "metadata_verified",
    "verified_on": "2026-09-15",
    "verified_by": "ChatGPT web verification; independent human reviewer pending",
    "provenance": "Official NICE recommendation/resource pages remain publicly available and were checked during this MVP pass.",
    "limitations": ["Older guideline; newer systematic reviews and guidelines must be checked before high-stakes publication", "Some medication and service recommendations may have changed outside this guideline"],
    "conflicts_or_funding_notes": null,
    "supersession_status": "supersession_check_needed",